arxiv_id,title,authors,publish_date,page_count,first_author_affiliation,relevance_score,abstract_summary
2512.23480,Agentic AI for Autonomous Defense in Software Supply Chain Security,"Toqeer Ali Syed, Mohammad Riyaz Belgaum, Salman Jan, Asadullah Abdullah Khan, Saad Said Alqahtani",2025-12-29,15,Unknown,9,"Framework combining LLM reasoning, RL, and multi-agent coordination for proactive supply chain security"
2512.23132,Multi-Agent Framework for Threat Mitigation and Resilience in AI-Based Systems,"Armstrong Foundjem, Lionel Nganyewou Tidjon, Leuson Da Silva, Foutse Khomh",2025-12-28,56,Polytechnique Montreal,9,Identifies 93 threats across ML lifecycle with focus on supply-chain and inference risks
2510.05159,Malice in Agentland: Backdoors in the AI Supply Chain,"Léo Boisvert, Abhay Puri, Chandra Kiran Reddy Evuru, Nicolas Chapados, Quentin Cappart, Alexandre Lacoste, Krishnamurthy Dj Dvijotham, Alexandre Drouin",2025-10-14,27,ServiceTitan,9,Backdoor attacks targeting data collection pipelines in agentic AI via poisoning (80%+ success with 2% poison)
2509.15572,Cuckoo Attack: Stealthy and Persistent Attacks Against AI-IDE,"Xinpeng Liu, Junming Liu, Peiyu Liu, Han Zheng, Qinying Wang, Mathias Payer, Shouling Ji, Wenhai Wang",2025-09-19,14,Zhejiang University,8,AI-IDE configuration file exploitation enabling local and supply chain attacks
2508.20307,Surveying the Operational Cybersecurity and Supply Chain Threat Landscape,"Michael R Smith, Joe Ingram",2025-08-27,11,Unknown,8,Comprehensive threat assessment across AI lifecycle emphasizing output manipulation vs traditional attacks
2508.19774,The Art of Hide and Seek: Pickle-Based Model Supply Chain Poisoning,"Tong Liu, Guozhu Meng, Peng Zhou, Zizhuang Deng, Shuaiyin Yao, Kai Chen",2025-08-27,18,ICT/CAS,9,Deserialization vulnerabilities in model-sharing platforms with 89% detection bypass rate
2505.22778,Machine Learning Models Have a Supply Chain Problem,"Sarah Meiklejohn, Hayden Blauzvern, Mihai Maruseac, Spencer Schrock, Laurent Simon, Ilia Shumailov",2025-05-01,12,Google,9,"ML ecosystem supply chain risks: malicious model replacement, framework dependency vulnerabilities"
2505.01067,A Rusty Link in the AI Supply Chain: Detecting Evil Configurations in Model Repositories,"Ziqi Ding, Qian Fu, Junchen Ding, Gelei Deng, Yi Liu, Yuekang Li",2025-05-01,10,Unknown,8,Configuration file vulnerabilities in Hugging Face enabling unauthorized code execution
2502.19567,Atlas: ML Lifecycle Provenance & Transparency Framework,"Marcin Spoczynski, Marcela S. Melara, Sebastian Szyller",2025-02-26,12,University of Colorado Boulder,8,Framework for fully attestable ML pipelines addressing data poisoning and supply chain attacks
2502.05206,Safety at Scale: A Comprehensive Survey of Large Model and Agent Safety,"Xingjun Ma, et al.",2025-02-02,60,University of Melbourne,8,"Systematic taxonomy covering backdoors, data poisoning, and agent-specific threats across ML pipelines"
2410.04490,A Large-Scale Exploit Instrumentation Study of AI/ML Supply Chain Attacks,"Beatrice Casey, Joanna C. S. Santos, Mehdi Mirakhorli",2024-10-06,12,Northeastern University,9,Unsafe serialization exploitation across Hugging Face creating systematic supply chain vulnerabilities
2511.01395,Characterizing Build Compromises Through Vulnerability Disclosure Analysis,"Maimouna Tamah Diao, et al.",2025-11-03,13,University of Rennes,8,Analysis of 621 vulnerabilities showing 23.8% of supply chain attacks exploit build infrastructure
2511.13341,LLM-based Quantitative Framework for Evaluating Backdoor Risks in OSS Supply Chains,"Zihe Yan, Kai Luo, Haoyu Yang, Yang Yu, Zhuosheng Zhang, Guancheng Li",2025-11-17,10,Unknown,8,LLM-based evaluation of backdoor risks in open-source dependencies across 66 Debian packages
2511.12668,AI Bill of Materials and Beyond: Systematizing Security Assurance through the AI Risk Scanning (AIRS) Framework,"Samuel Nathanson, Alexander Lee, et al.",2025-11-01,13,NIST,8,Threat-model-based AI assurance framework aligned to MITRE ATLAS for model integrity
2510.08609,Which Is Better For Reducing Outdated and Vulnerable Dependencies: Pinning or Floating?,"Imranur Rahman, Jill Marley, William Enck, Laurie Williams",2025-10-23,11,NC State University,8,"Empirical evaluation of version constraint strategies across npm, PyPI, and Cargo ecosystems"
2509.07941,ImportSnare: Directed Code Manual Hijacking in Retrieval-Augmented Code Generation,"Kai Ye, Liangcai Su, Chenxiong Qian",2025-09-09,10,Tsinghua University,8,Poisoned documentation attacks on LLM-assisted development with 50%+ success rates
2502.06662,Pinning Is Futile: You Need More Than Local Dependency Versioning to Defend against Supply Chain Attacks,"Hao He, Bogdan Vasilescu, Christian Kästner",2025-02-10,14,Carnegie Mellon University,8,Counterfactual analysis showing pinning paradoxically increases risk in larger dependency graphs
2505.13804,QUT-DV25: A Dataset for Dynamic Analysis of Next-Gen Software Supply Chain Attacks,"Sk Tanzir Mehedi, Raja Jurdak, Chadni Islam, Gowri Ramachandran",2025-05-19,9,Queensland University of Technology,8,"Dynamic analysis dataset of 14,271 Python packages identifying 4 previously benign malicious packages"
2505.11016,GoLeash: Mitigating Golang Software Supply Chain Attacks with Runtime Policy Enforcement,"Carmine Cesarano, Martin Monperrus, Roberto Natella",2025-05-16,11,University of Naples Federico II,7,Package-level least privilege enforcement for Go ecosystems against malicious packages
2502.08219,Tracking Down Software Cluster Bombs: A Current State Analysis of the FLOSS Ecosystem,"Stefan Tatschner, et al.",2025-02-12,9,University of Applied Sciences Darmstadt,7,FLOSS repository analysis identifying supply chain attack susceptibilities for CRA compliance
2501.19012,Importing Phantoms: Measuring LLM Package Hallucination Vulnerabilities,"Arjun Krishna, Erick Galinkin, Leon Derczynski, Jeffrey Martin",2025-01-31,8,University of Copenhagen,7,LLM package hallucination analysis showing model-specific dependency vulnerability patterns
2502.04484,"An Empirical Analysis of Machine Learning Model and Dataset Documentation, Supply Chain, and Licensing Challenges on Hugging Face","Trevor Stalnaker, et al.",2025-02-01,11,College of William and Mary,8,"Analysis of 760,460 Hugging Face models identifying documentation and supply chain gaps"
2401.12443,Patch2QL: Discover Cognate Defects in Open Source Software Supply Chain With Auto-generated Static Analysis Rules,"Fuwei Wang, Yongzhi Liu, Zhiqiang Dong",2024-01-01,10,Unknown,7,Auto-generation of static analysis rules to detect defects and vulnerability propagation in OSS
